{
  "project_id": "EXAMPLE-FRIDGE-001",
  "prompt_id": "MVP1",
  "asset_id": "A0",
  "operation": "generate_reference_pack",
  "capture_profile": {
    "capture_profile_id": "CAP1",
    "capture_mode": "smartphone",
    "device_class": "modern flagship-class smartphone main camera, natural computational photography",
    "lens_equivalent_mm": 26,
    "aperture_f": 1.8,
    "shutter_speed": "1/125s",
    "iso": 80,
    "white_balance_kelvin": 5000,
    "camera_height_m": 1.35,
    "subject_distance_m": 2.4,
    "focus": "single-point autofocus locked on the refrigerator body; keep the complete product sharp enough for documentation",
    "exposure": "neutral indoor exposure around -0.1 EV; preserve dark-surface detail without lifted HDR shadows",
    "lighting": "soft natural window daylight from camera-right plus weak ambient room fill; no studio flash",
    "stabilization": "normal handheld optical/electronic stabilization; no artificial motion blur",
    "processing": "natural smartphone JPEG/HEIC look with restrained HDR, neutral sharpening, realistic micro-contrast and no beauty/product-ad retouching",
    "realism_rules": [
      "retain subtle sensor-like texture and ordinary household contrast",
      "avoid perfectly clean CGI gradients and mirror-smooth surfaces",
      "keep vertical edges believable and avoid ultra-wide stretching",
      "use realistic contact shadows and small imperfect reflections"
    ]
  },
  "subject_lock": {
    "entity_ids": [
      "fridge_01"
    ],
    "canonical_description": "One realistic dark charcoal household refrigerator with a top-freezer two-door layout. The upper freezer door is clearly smaller than the lower refrigerator door. A thin brushed-silver horizontal trim separates the doors. Handles are minimal recessed vertical grips along the left door edges. The cabinet is a simple rectangular freestanding body with flat dark side panels, small adjustable feet, subtle panel seams, and no external water/ice dispenser. It must look like an ordinary mass-produced appliance that could physically exist in a home.",
    "must_preserve": [
      "dark charcoal matte/satin coated-metal body",
      "two-door top-freezer architecture",
      "upper freezer door smaller than lower fresh-food door",
      "thin brushed-silver horizontal divider trim",
      "recessed vertical left-edge handle geometry",
      "same cabinet width-height-depth proportions",
      "same top panel, side-panel seams, feet and door thickness",
      "same subtle surface finish and edge radii"
    ],
    "must_not_change": [
      "do not change door count or convert to French-door, side-by-side or bottom-freezer",
      "do not change body color or material between views",
      "do not add an ice/water dispenser, display panel, protruding bar handles or logo",
      "do not change the silver divider thickness or location",
      "do not change the depth, feet, top geometry or handle design between panels",
      "do not invent exposed internal refrigeration parts on the exterior"
    ]
  },
  "required_views": [
    {
      "view_id": "front",
      "label": "FRONT",
      "yaw_degrees": 0,
      "pitch_degrees": 0,
      "framing": "full product, straight-on, entire top and feet visible with small margins",
      "purpose": "lock door layout, proportions, trim and handle identity"
    },
    {
      "view_id": "front_left_45",
      "label": "FRONT LEFT 45°",
      "yaw_degrees": -45,
      "pitch_degrees": 0,
      "framing": "full product, front and left side both clearly visible",
      "purpose": "lock cabinet depth and left-side geometry"
    },
    {
      "view_id": "front_right_45",
      "label": "FRONT RIGHT 45°",
      "yaw_degrees": 45,
      "pitch_degrees": 0,
      "framing": "full product, front and right side both clearly visible",
      "purpose": "lock cabinet depth and right-side geometry"
    },
    {
      "view_id": "left",
      "label": "LEFT SIDE",
      "yaw_degrees": -90,
      "pitch_degrees": 0,
      "framing": "full product side elevation with front/rear edges readable",
      "purpose": "lock side profile and depth"
    },
    {
      "view_id": "right",
      "label": "RIGHT SIDE",
      "yaw_degrees": 90,
      "pitch_degrees": 0,
      "framing": "full product side elevation with front/rear edges readable",
      "purpose": "lock opposite side profile and depth"
    },
    {
      "view_id": "rear_left_45",
      "label": "REAR LEFT 45°",
      "yaw_degrees": -135,
      "pitch_degrees": 0,
      "framing": "full product with rear plane dominant and left side visible",
      "purpose": "primary reference for rear-warm scenes"
    },
    {
      "view_id": "rear_right_45",
      "label": "REAR RIGHT 45°",
      "yaw_degrees": 135,
      "pitch_degrees": 0,
      "framing": "full product with rear plane dominant and right side visible",
      "purpose": "secondary rear reference and cross-check"
    },
    {
      "view_id": "rear",
      "label": "REAR",
      "yaw_degrees": 180,
      "pitch_degrees": 0,
      "framing": "full straight rear elevation; complete back casing and feet visible",
      "purpose": "lock rear exterior geometry without inventing internals"
    }
  ],
  "environment": {
    "location": "ordinary modern home kitchen / utility area, clean but lived-in, with enough clearance around the appliance for documentation photography",
    "background": "neutral light wall with restrained light-wood cabinetry kept secondary; no showroom sweep, no advertising set, no people",
    "floor": "light neutral tile or wood-look flooring with realistic contact shadow",
    "lighting_continuity": "same soft daylight direction, color temperature and exposure logic in every panel"
  },
  "board_composition": {
    "layout": "single 16:9 reference board, 4 columns × 2 rows, eight equal panels in required_views order",
    "panel_rules": [
      "one refrigerator per panel and exactly eight panels total",
      "use the same apparent product scale across comparable full-body views",
      "keep panel backgrounds simple and visually consistent",
      "do not overlap products across panel boundaries",
      "make each view large enough to inspect handles, trim, panel seams and proportions"
    ],
    "labels": "small plain uppercase labels below each panel: FRONT, FRONT LEFT 45°, FRONT RIGHT 45°, LEFT SIDE, RIGHT SIDE, REAR LEFT 45°, REAR RIGHT 45°, REAR; no other text",
    "crop_rules": [
      "never crop the refrigerator top, feet, front/rear edges or side depth",
      "leave a small consistent margin around the complete appliance",
      "do not use close-up crops in this canonical board"
    ]
  },
  "cross_view_consistency_rules": [
    "treat all panels as photographs of one exact physical refrigerator moved relative to the camera, never as separate design variations",
    "front width, cabinet depth and total height must remain geometrically coherent across orthogonal and 45-degree views",
    "door heights, silver divider, handle positions, feet, top surface and edge radii must align logically between adjacent views",
    "left and right side profiles must agree with the depth implied by both front 45-degree and rear 45-degree views",
    "rear width and height must match the front; rear casing must be plausible, restrained and consistent across rear/rear-45 panels",
    "lighting direction, body color, finish, exposure and background family must remain consistent across every panel"
  ],
  "realism_rules": [
    "make each panel look like a real handheld smartphone product-documentation photograph, not a 3D render",
    "use natural coated-metal reflections, small household imperfections and plausible contact shadows",
    "preserve readable dark-surface detail without making the charcoal body glossy black",
    "avoid excessive depth of field blur; the full appliance must be documentable",
    "perspective must match a 26 mm-equivalent smartphone main camera at the stated distance and camera height",
    "avoid perfectly centered advertising symmetry except the straight front/rear elevation views"
  ],
  "technical_constraints": [
    "A0 documents only visible exterior geometry; do not reveal or fabricate compressor, condenser, refrigerant tubing, evaporator or hidden internals",
    "rear casing may include generic believable covers/vents only when necessary, but must not imply a specific undocumented refrigeration layout",
    "do not add heat arrows, thermal glow, labels other than view names, or explanatory graphics"
  ],
  "negative_constraints": [
    "no CGI, 3D-render, illustration or concept-art look",
    "no studio cyclorama or luxury showroom staging",
    "no people, hands or reflections of a photographer",
    "no logos, brand names, watermarks or advertising text",
    "no warped straight edges, duplicated handles, extra doors, missing feet or changing panel seams",
    "no different refrigerator model between views",
    "no ultra-wide fisheye distortion",
    "no dramatic bokeh, cinematic haze, bloom, neon rim light or unrealistic glow",
    "no open doors or visible interior in this board",
    "no invented exposed refrigeration components"
  ],
  "output_spec": {
    "aspect_ratio": "16:9",
    "width": 3072,
    "height": 1728,
    "transparent_background": false
  },